Sheet: Sheet1
A1: A | B1: B | C1: C | D1: D | E1: E
A2: skip this | B2: skip this | C2: skip this | D2: skip this | E2: skip this
A3: a | B3: b | C3: c | D3: d | E3: e
A4: of:=RANDBETWEEN(0; 100) -> 10 | B4: of:=RANDBETWEEN(0; 100) -> 0 | C4: of:=RANDBETWEEN(0; 100) -> 58 | D4: of:=RANDBETWEEN(0; 100) -> 29 | E4: of:=RANDBETWEEN(0; 100) -> 77
A5: of:=RANDBETWEEN(0; 100) -> 5 | B5: of:=RANDBETWEEN(0; 100) -> 47 | C5: of:=RANDBETWEEN(0; 100) -> 50 | D5: of:=RANDBETWEEN(0; 100) -> 99 | E5: of:=RANDBETWEEN(0; 100) -> 79
A6: of:=RANDBETWEEN(0; 100) -> 75 | B6: of:=RANDBETWEEN(0; 100) -> 25 | C6: of:=RANDBETWEEN(0; 100) -> 86 | D6: of:=RANDBETWEEN(0; 100) -> 47 | E6: of:=RANDBETWEEN(0; 100) -> 65
A7: of:=RANDBETWEEN(0; 100) -> 82 | B7: of:=RANDBETWEEN(0; 100) -> 45 | C7: of:=RANDBETWEEN(0; 100) -> 88 | D7: of:=RANDBETWEEN(0; 100) -> 48 | E7: of:=RANDBETWEEN(0; 100) -> 74
A8: of:=RANDBETWEEN(0; 100) -> 72 | B8: of:=RANDBETWEEN(0; 100) -> 47 | C8: of:=RANDBETWEEN(0; 100) -> 57 | D8: of:=RANDBETWEEN(0; 100) -> 82 | E8: of:=RANDBETWEEN(0; 100) -> 46
A9: of:=RANDBETWEEN(0; 100) -> 40 | B9: of:=RANDBETWEEN(0; 100) -> 54 | C9: of:=RANDBETWEEN(0; 100) -> 26 | D9: of:=RANDBETWEEN(0; 100) -> 97 | E9: of:=RANDBETWEEN(0; 100) -> 1
A10: of:=RANDBETWEEN(0; 100) -> 54 | B10: of:=RANDBETWEEN(0; 100) -> 26 | C10: of:=RANDBETWEEN(0; 100) -> 99 | D10: of:=RANDBETWEEN(0; 100) -> 63 | E10: of:=RANDBETWEEN(0; 100) -> 49
A11: of:=RANDBETWEEN(0; 100) -> 87 | B11: of:=RANDBETWEEN(0; 100) -> 24 | C11: of:=RANDBETWEEN(0; 100) -> 47 | D11: of:=RANDBETWEEN(0; 100) -> 87 | E11: of:=RANDBETWEEN(0; 100) -> 15